Company,Date Joined,Industry,City,Country,Continent,Year Founded,Select Investors, Funds,Valuation,Year Joined,Return
Kitopi,7/1/2021,"Supply chain, logistics, & delivery",Dubai,United Arab Emirates,Asia,2018,"CE-Ventures, BECO Capital, Nordstar",504,1000,2021,496
KK Group,10/23/2019,E-commerce & direct-to-consumer,Dongguan,China,Asia,2014,"Matrix Partners China, Bright Venture Capita, Shenzhen Capital Group",612,3000,2019,2388
Klarna,12/12/2011,Fintech,Stockholm,Sweden,Europe,2005,"Institutional Venture Partners, Sequoia Capital, General Atlantic",4000,46000,2011,42000
Klaviyo,11/17/2020,Internet software & services,Boston,United States,North America,2012,"Summit Partners, Accel, Astral Capital",679,9000,2020,8321
Klook,8/7/2018,Travel,Central,Hong Kong,Asia,2014,"Sequoia Capital China, Goldman Sachs, Matrix Partners China",722,1000,2018,278
KnowBox,5/30/2019,Edtech,Beijing,China,Asia,2014,"TAL Education Group, Legend Star, Alibaba Group",306,1000,2019,694
Komodo Health,5/22/2020,Health,San Francisco,United States,North America,2014,"Andreessen Horowitz, IA Ventures, Felicis Ventures",314,3000,2020,2686
Konfio,9/29/2021,Fintech,Mexico City,Mexico,North America,2013,"Kaszek Ventures, QED Investors, International Finance Corporation",378,1000,2021,622
Kong,12/31/2020,Internet software & services,San Francisco,United States,North America,2007,"New Enterprise Associates, CRV, Index Ventures",169,1000,2020,831
Kopi Kenangan,12/27/2021,Consumer & retail,Jakarta,Indonesia,Asia,2017,"Horizons Ventures, Sequoia Capital India, Alpha JWC Ventures",333,1000,2021,667
Koudai,10/23/2014,E-commerce & direct-to-consumer,Beijing,China,Asia,2010,"New Enterprise Associates, Tiger Global management, Tencent",368,1000,2014,632
Kraken,6/25/2019,Fintech,San Francisco,United States,North America,2011,"Bnk To The Future, Trammell Ventures, SBI Investment",119,4000,2019,3881
KRY,4/27/2021,Health,Stockholm,Sweden,Europe,2014,"Index Ventures, Creandum, Accel",569,2000,2021,1431
Kuaigou Dache,7/13/2018,"Supply chain, logistics, & delivery",Tianjin,China,Asia,2014,"Sequoia Capital China, InnoVision Capital, Qianhai Fund of Funds",650,1000,2018,350
Kuaikan Manhua,12/1/2017,Internet software & services,Beijing,China,Asia,2014,"Sequoia Capital China, CMC Capital Partners, Tencent Holdings",594,1000,2017,406
Kujiale,10/25/2019,Internet software & services,Hangzhou,China,Asia,2011,"GGV Capital, IDG Capital, Linear Venture",235,1000,2019,765
Kurly,7/9/2021,"Supply chain, logistics, & delivery",Seoul,South Korea,Asia,2014,"Sequoia Capital China, DST Global, DST Global",770,3000,2021,2230
L&P Cosmetic,1/1/2016,Consumer & retail,Seoul,South Korea,Asia,2009,CDIB Capital,33,1000,2016,967
Lacework,1/7/2021,Cybersecurity,San Jose,United States,North America,2015,"Sutter Hill Ventures, Liberty Global Ventures, Coatue Management",2000,8000,2021,6000
Lalamove,2/21/2019,"Supply chain, logistics, & delivery",Cheung Sha Wan,Hong Kong,Asia,2013,"MindWorks Ventures, Shunwei Capital Partners, Xiang He Capital",2000,10000,2019,8000
Lamabang,3/6/2015,E-commerce & direct-to-consumer,Shenzhen,China,Asia,2011,"5Y Capital, Matrix Partners China, K2VC",130,1000,2015,870
Lattice,3/23/2021,Internet software & services,San Francisco,United States,North America,2015,"Khosla Ventures, Thrive Capital, Y Combinator",329,3000,2021,2671
LaunchDarkly,8/10/2021,Internet software & services,Oakland,United States,North America,2014,"Uncork Capital, Threshold Ventures, Bloomberg Beta",330,3000,2021,2670
LayerZero Labs,3/30/2022,Internet software & services,New York,United States,North America,2021,"Andreessen Horowitz, FTX Ventures, Tiger Global Management",143,1000,2022,857
LEAD School,1/13/2022,Edtech,Andheri,India,Asia,2012,"WestBridge Capital, GSV Ventures, Elevar Equity",166,1000,2022,834
Leap Motor,11/20/2018,Auto & transportation,Hangzhou,China,Asia,2015,"Sequoia Capital China, Gopher Asset Management, Shanghai Electric Group",1000,1000,2018,0
Ledger,6/10/2021,Hardware,Paris,France,Europe,2014,"Digital Currency Group, Draper Esprit, Korelya Capital",466,2000,2021,1534
Lendable,3/31/2021,Fintech,London,United Kingdom,Europe,2014,"Ontario Teachers' Pension Plan, Goldman Sachs",286,5000,2021,4714
Lenskart,12/20/2019,E-commerce & direct-to-consumer,Faridabad,India,Asia,2008,"Chiratae Ventures, PremjiInvest, Softbank",776,4000,2019,3224
Lessen,11/30/2021,Internet software & services,Scottsdale,United States,North America,2019,"Khosla Ventures, General Catalyst, Navitas Capital",205,1000,2021,795
LetsGetChecked,6/7/2021,Health,Dublin,Ireland,Europe,2015,"Optum Ventures, Qiming Venture Partners, Transformation Capital",263,1000,2021,737
Lianjia,4/7/2016,E-commerce & direct-to-consumer,Beijing,China,Asia,2001,"Tencent, Baidu, Huasheng Capital",1000,6000,2016,5000
Licious,10/5/2021,E-commerce & direct-to-consumer,Bengaluru,India,Asia,2015,"3one4 Capital Partners, Bertelsmann India Investments, Vertex Ventures SE Asia",489,1000,2021,511
LifeMiles,7/13/2015,Other,Bogota,Colombia,South America,2011,Advent International,344,1000,2015,656
Lightricks,7/31/2019,Artificial Intelligence,Jerusalem,Israel,Asia,2013,"Viola Ventures, Insight Partners, ClalTech, Goldman Sachs",305,2000,2019,1695
LinkDoc Technology,7/5/2018,Health,Beijing,China,Asia,2014,"China Investment Corporation, New Enterprise Associates",253,1000,2018,747
LinkSure Network,1/1/2015,Mobile & telecommunications,Shanghai,China,Asia,2013,"N5 Capital, CR Capital Mgmt, JD Digits",52,1000,2015,948
LinkTree,3/16/2022,Internet software & services,Melbourne,Australia,Oceania,2016,"AirTree Ventures, Insight Partners, Index Ventures",166,1000,2022,834
LivSpace,2/8/2022,E-commerce & direct-to-consumer,Bengaluru,India,Asia,2015,"Jungle Ventures, Helion Venture Partners, INGKA Investments",427,1000,2022,573
Loadsmart,2/1/2022,"Supply chain, logistics, & delivery",New York,United States,North America,2014,"Chromo Invest, Maersk Growth, BlackRock",336,1000,2022,664
Locus Robotics,2/17/2021,Hardware,Wilmington,United States,North America,2014,"Scale Venture Partners, Bond, Tiger Global Management",299,1000,2021,701
Loft,1/3/2020,E-commerce & direct-to-consumer,Sao Paulo,Brazil,South America,2018,"Monashees+, Andreessen Horowitz, QED Investors",788,3000,2020,2212
Loggi,6/5/2019,"Supply chain, logistics, & delivery",Sao Paulo,Brazil,South America,2013,"Qualcomm Ventures, SoftBank Group, Monashees+",507,2000,2019,1493
Lookout,10/10/2013,Cybersecurity,San Francisco,United States,North America,2007,"Accel Partners, Greylock Partners, Lowercase Capital",282,1000,2013,718
Loom,5/20/2021,Internet software & services,San Francisco,United States,North America,2016,"Kleiner Perkins Caufield & Byers, Sequoia Capital, General Catalyst",204,2000,2021,1796
LTK,11/22/2021,Internet software & services,Dallas,United States,North America,2011,"SoftBank Group, Maverick Capital",315,2000,2021,1685
Lucid,6/29/2021,Internet software & services,South Jordan,United States,North America,2010,"Spectrum Equity, ICONIQ Capital, Grayhawk Capital",170,3000,2021,2830
Lukka,1/14/2022,Fintech,New York,United States,North America,2014,"Liberty City Ventures, Soros Fund Management, Summer Capital",201,1000,2022,799
Lunar,7/12/2021,Fintech,Aarhus,Denmark,Europe,2015,"SEED Capital, Greyhound Capital, Socii Capital",448,2000,2021,1552
Luoji Siwei,7/20/2017,Edtech,Beijing,China,Asia,2012,"Sequoia Capital China, Qiming Venture Partners, Tencent Holdings",144,1000,2017,856
Lusha,11/10/2021,Internet software & services,New York,United States,North America,2016,"PSG, ION Crossover Partners",245,2000,2021,1755
Lydia,12/8/2021,Fintech,Paris,France,Europe,2011,"NewAlpha, XAnge Private Equity, Tencent Holdings",263,1000,2021,737
Lyra Health,8/25/2020,Health,Burlingame,United States,North America,2015,"Greylock Partners, Venrock, Providence Ventures",910,6000,2020,5090
M1 Finance,7/14/2021,Fintech,Chicago,United States,North America,2015,"Left Lane Capital, Clocktower Technology Ventures, Jump Capital",323,1000,2021,677
MadeiraMadeira,1/7/2021,E-commerce & direct-to-consumer,Parana,Brazil,South America,2009,"Flybridge Capital Partners, SoftBank Group, Monashees+",336,1000,2021,664
Mafengwo,5/23/2019,Travel,Beijing,China,Asia,2010,"Qiming Venture Partners, Capital Today, General Atlantic",503,2000,2019,1497
Magic Leap,10/21/2014,Hardware,Plantation,United States,North America,2010,"Obvious Ventures, Qualcomm Ventures, Andreessen Horowitz",3000,2000,2014,-1000
Maimai,11/15/2017,Mobile & telecommunications,Beijing,China,Asia,2013,"Morningside Venture Capital, IDG Capital, DCM Ventures",300,1000,2017,700
Mamaearth,12/28/2021,E-commerce & direct-to-consumer,Gurgaon,India,Asia,2016,"Fireside Ventures, Sequoia Capital India, Stellaris Venture Partners",111,1000,2021,889
Mambu,1/6/2021,Fintech,Amsterdam,Netherlands,Europe,2011,"Runa Capital, Acton Capital Partners, Point Nine Capital",448,6000,2021,5552
Mammoth Biosciences,9/9/2021,Health,Brisbane,United States,North America,2017,"NFX, Plum Alley, Mayfield",265,1000,2021,735
Manner,12/24/2020,Other,Shanghai,China,Asia,2015,"Coatue Management, H Capital, Capital Today",10,1000,2020,990
ManoMano,7/5/2021,E-commerce & direct-to-consumer,Paris,France,Europe,2013,"General Atlantic, Piton Capital, Partech Partners",706,3000,2021,2294
Marshmallow,9/8/2021,Fintech,London,United Kingdom,Europe,2017,"Passion Capital, Hedosophia, Outrun Ventures",116,1000,2021,884
MasterClass,5/13/2021,Edtech,San Francisco,United States,North America,2015,"Institutional Venture Partners, New Enterprise Associates, Javelin Venture Partners",461,3000,2021,2539
Masterworks,10/5/2021,Fintech,New York,United States,North America,2017,"Left Lane Capital, Galaxy Interactive, Tru Arrow Partners",110,1000,2021,890
Matillion,9/15/2021,Data management & analytics,Altrincham,United Kingdom,Europe,2011,"Scale Venture Partners, Sapphire Ventures, Battery Ventures",310,2000,2021,1690
Matrixport,6/1/2021,Fintech,Singapore,Singapore,Asia,2019,"Dragonfly Captial, Qiming Venture Partners, DST Global",100,1000,2021,900
Maven Clinic,8/17/2021,Health,New York,United States,North America,2014,"Female Founders Fund, Oak HC/FT Partners, Sequoia Capital",202,1000,2021,798
Medable,10/26/2021,Internet software & services,Palo Alto,United States,North America,2013,"GSR Ventures, Sapphire Ventures, Streamlined Ventures",507,2000,2021,1493
MediaMath,7/10/2018,Internet software & services,New York,United States,North America,2007,"Silicon Valley Bank, QED Investors, European Founders Fund",325,1000,2018,675
Medlinker,7/31/2018,Health,Chengdu,China,Asia,2014,"China Health Industry Investment Fund, China Renaissance, and Sequoia Capital China",761,4000,2018,3239
Meero,6/18/2019,Artificial Intelligence,Paris,France,Europe,2016,"Aglae Ventures, Global Founders Capital, Alven Capital",293,1000,2019,707
Meesho,4/5/2021,Internet software & services,Bengaluru,India,Asia,2015,"Venture Highway, Sequoia Capital India, Prosus Ventures",1000,5000,2021,4000
MEGVII,10/31/2017,Artificial Intelligence,Beijing,China,Asia,2011,"Ant Financial Services Group, Russia-China Investment Fund, Foxconn Technology Company",1000,4000,2017,3000
Meicai,6/22/2016,Mobile & telecommunications,Beijing,China,Asia,2014,"Tiger Global Management, Blue Lake Capital, ZhenFund",1000,7000,2016,6000
Meizu Technology,7/23/2014,Hardware,Zhuhai,China,Asia,2003,"Telling Telecommunication Holding Co., Alibaba Group",943,5000,2014,4057
Melio,1/25/2021,Fintech,New York,United States,North America,2018,"Accel, Aleph, American Express Ventures",504,4000,2021,3496
Mensa Brands,11/16/2021,Other,Bengaluru,India,Asia,2021,"Accel, Falcon Edge Capital, Norwest Venture Partners",218,1000,2021,782
Merama,12/9/2021,E-commerce & direct-to-consumer,Mexico City,Mexico,North America,2020,"SoftBank Latin America Fund, Advent International, Balderton Capital",345,1000,2021,655
Mercury,7/3/2021,Fintech,San Francisco,United States,North America,2019,"Andreessen Horowitz, Coatue Management, Clocktower Technology Ventures",421,2000,2021,1579
MessageBird,10/8/2020,Mobile & telecommunications,Amsterdam,Netherlands,Europe,2011,"Y Combinator, Atomico, Accel",1000,3000,2020,2000
Mia.com,9/8/2015,E-commerce & direct-to-consumer,Beijing,China,Asia,2011,"Sequoia Capital China, ZhenFund, K2 Ventures",232,1000,2015,768
Miaoshou Doctor,6/27/2019,E-commerce & direct-to-consumer,Beijing,China,Asia,2015,"Sequoia Capital China, Qiming Venture Partners, Tencent Holdings",90470,1000,2019,-89470
MindMaze,1/28/2016,Health,Lausanne,Switzerland,Europe,2012,Hinduja Group,340,2000,2016,1660
MindTickle,8/3/2021,Internet software & services,San Francisco,United States,North America,2012,"Qualcomm Ventures, Accel, Canaan Partners",281,1000,2021,719
Mininglamp Technology,3/27/2019,Artificial Intelligence,Beijing,China,Asia,2014,"Russia-China Investment Fund, Tencent Holdings, Sequoia Capital China",787,1000,2019,213
Minio,1/26/2022,Data management & analytics,Palo Alto,United States,North America,2014,"General Catalyst, Nexus Venture Partners, Dell Technologies Capital",126,1000,2022,874
Mirakl,9/22/2020,E-commerce & direct-to-consumer,Paris,France,Europe,2011,"Elaia Partners, 83North, Felix Capital",948,4000,2020,3052
Miro,1/5/2022,Internet software & services,San Francisco,United States,North America,2011,"Accel, AltaIR Capital, Technology Crossover Ventures",918,18000,2022,17082
Misfits Market,4/21/2021,E-commerce & direct-to-consumer,Pennsauken,United States,North America,2018,"Accel, D1 Capita Partners, Greenoaks Capital Management",527,2000,2021,1473
Mixpanel,11/15/2021,Internet software & services,San Francisco,United States,North America,2009,"Bain Capital Tech Opportunities, Andreessen Horowitz, Sequoia Capital",277,1000,2021,723
MobiKwik,10/13/2021,Fintech,Gurugram,India,Asia,2009,"Sequoia Capital India, The Times Group, GMO VenturePartners",249,1000,2021,751
Mobile Premier League,9/15/2021,Internet software & services,Bengaluru,India,Asia,2018,"Sequoia Capital India, RTP Global, Go-Ventures",376,2000,2021,1624
MobileCoin,7/7/2021,Fintech,San Francisco,United States,North America,2018,"General Catalyst, Future Ventures, AU21",107,1000,2021,893
Mobvoi,4/6/2017,Consumer & retail,Beijing,China,Asia,2012,"Sequoia Capital China, SIG Asia Investments, ZhenFund",252,1000,2017,748
Modern Health,2/11/2021,Health,San Francisco,United States,North America,2017,"Kleiner Perkins Caufield & Byers, Afore Capital, Founders Fund",167,1000,2021,833
Modern Treasury,10/6/2021,Fintech,San Francisco,United States,North America,2018,"Benchmark, Altimeter Capital, Quiet Capital",183,2000,2021,1817
Modernizing Medicine,5/10/2017,Health,Boca Raton,United States,North America,2010,"Warburg Pincus, Summit Partners, Sands Capital",394,1000,2017,606
Mofang Living,4/13/2016,E-commerce & direct-to-consumer,Shanghai,China,Asia,2009,"Warburg Pincus, Aviation Industry Corporation of China",650,1000,2016,350
Moglix,5/17/2021,E-commerce & direct-to-consumer,Singapore,Singapore,Asia,2015,"Jungle Ventures, Accel, Venture Highway",471,3000,2021,2529
Moka,11/2/2021,Internet software & services,Beijing,China,Asia,2015,"GGV Capital, GSR Ventures, FreesFund",144,1000,2021,856
Mollie,9/8/2020,Fintech,Amsterdam,Netherlands,Europe,2004,Technology Crossover Ventures,928,6000,2020,5072
MOLOCO,4/29/2021,Artificial Intelligence,Redwood City,United States,North America,2013,"Smilegate Investment, DSC Investments, KTB Ventures",192,2000,2021,1808
Momenta,10/17/2018,Artificial Intelligence,Beijing,China,Asia,2016,"Sinovation Ventures, Tencent Holdings, Sequoia Capital China",1000,1000,2018,0
MoMo,12/10/2021,Fintech,Ho Chi Minh City,Vietnam,Asia,2013,"Goodwater Capital, Warburg Pincus, GS Growth",434,2000,2021,1566
Monzo,10/31/2018,Fintech,London,United Kingdom,Europe,2015,"Passion Capital, Thrive Capital, Orange Digital Ventures",1000,5000,2018,4000
Moon Active,1/26/2020,Mobile & telecommunications,Tel Aviv,Israel,Asia,2011,"Insight Partners, Andalusian Capital Partners",425,5000,2020,4575
MoonPay,11/22/2021,Fintech,Miami,United States,North America,2019,"New Enterprise Associates, Coatue Management, Tiger Global Management",555,4000,2021,3445
Morning Consult,6/8/2021,Internet software & services,Washington DC,United States,North America,2014,"Advance Venture Partners, Susquehanna Growth Equity, Lupa Systems",91,1000,2021,909
Motorway,11/29/2021,E-commerce & direct-to-consumer,London,United Kingdom,Europe,2017,"Marchmont Ventures, BMW i Ventures, Index Ventures",276,1000,2021,724
Moveworks,6/30/2021,Artificial Intelligence,Mountain View,United States,North America,2016,"Lightspeed Venture Partners, Sapphire Ventures, Kleiner Perkins Caufield & Byers",305,2000,2021,1695
Movile,7/12/2018,Mobile & telecommunications,Sao Paulo,Brazil,South America,1998,"Innova Capital - FIP, 3G Capital Management, Prosus Ventures",588,1000,2018,412
Mu Sigma,2/7/2013,Data management & analytics,Northbrook,United States,North America,2004,"Sequoia Capital, General Atlantic",211,2000,2013,1789
MURAL,7/20/2021,Internet software & services,San Francisco,United States,North America,2011,"Insight Partners, Tiger Global Management, Gradient Ventures",192,2000,2021,1808
MUSINSA,11/11/2019,E-commerce & direct-to-consumer,Seoul,South Korea,Asia,2001,Sequoia Capital,287,2000,2019,1713
Mux,4/30/2021,Internet software & services,San Francisco,United States,North America,2015,"Accel, Cobalt Capital, Andreessen Horowitz",174,1000,2021,826
MX Technologies,1/13/2021,Fintech,Lehi,United States,North America,2010,"Point72 Ventures, Pelion Venture Partners, Commerce Ventures",450,2000,2021,1550
MyGlamm,11/10/2021,E-commerce & direct-to-consumer,Mumbai,India,Asia,2015,"L'Occitane, Trifecta Capital, Bessemer Venture Partners",310,1000,2021,690
Mynt,11/1/2021,Fintech,Taguig City,Philippines,Asia,2015,"Insight Partners, Warburg Pincus, Ayala Corporation",475,2000,2021,1525
Mythical Games,11/4/2021,Internet software & services,Sherman Oaks,United States,North America,2018,"Javelin Venture Partners, Struck Capital, Alumni Ventures Group",260,1000,2021,740
N26,1/10/2019,Fintech,Berlin,Germany,Europe,2013,"Redalpine Venture Partners, Earlybird Venture Capital, Valar Ventures",2000,9000,2019,7000
National Stock Exchange of India,7/1/2020,Fintech,Mumbai,India,Asia,1998,"TA Associates, SoftBank Group, GS Growth",297,7000,2020,6703
Nature's Fynd,7/19/2021,Other,Chicago,United States,North America,2012,"Danone Manifesto Ventures, 1955 Capital, Breakthrough Energy Ventures",463,1000,2021,537
Neo4j,6/17/2021,Data management & analytics,San Mateo,United States,North America,2007,"Eight Roads Ventures, One Peak Partners, Creandum",408,2000,2021,1592
Neon,2/14/2022,Fintech,Sao Paulo,Brazil,South America,2016,"Propel Venture Partners, Monashees+, BBVA",720,1000,2022,280
Netlify,11/17/2021,Internet software & services,San Francisco,United States,North America,2014,"Andreessen Horowitz, Kleiner Perkins Caufield & Byers, EQT Ventures",202,2000,2021,1798
Netskope,11/13/2018,Cybersecurity,Santa Clara,United States,North America,2012,"Lightspeed Venture Partners, Social Capital, Accel",1000,8000,2018,7000
Newlink Group,7/10/2020,E-commerce & direct-to-consumer,Beijing,China,Asia,2016,"JOY Capital, NIO Capital, Blueflame Capital",655,1000,2020,345
News Break,1/7/2021,Internet software & services,Mountain View,United States,North America,2015,"IDG Capital, Francisco Partners, ZhenFund",151,1000,2021,849
Newsela,2/25/2021,Internet software & services,New York,United States,North America,2013,"Owl Ventures, Technology Crossover Ventures, Tao Capital Partners",172,1000,2021,828
Nexii,9/8/2021,Other,Vancouver,Canada,North America,2020,"Trane Technologies, Honeywell",45,1000,2021,955
Next Insurance,10/7/2019,Fintech,Palo Alto,United States,North America,2016,"Zeev Ventures, Ribbit Capital, TLV Partners",881,4000,2019,3119
Next Silicon,6/14/2021,Hardware,Tel Aviv,Israel,Asia,2018,"Amiti Ventures, Playground Global, Aleph",203,2000,2021,1797
Nexthink,2/8/2021,Data management & analytics,Prilly,Switzerland,Europe,2004,"Auriga, Galeo Ventures, Highland Europe",346,1000,2021,654
Nextiva,9/14/2021,Internet software & services,Scottsdale,United States,North America,2008,Goldman Sachs Asset Management,200,3000,2021,2800
Niantic,11/24/2017,Mobile & telecommunications,San Francisco,United States,North America,2015,"Nintendo, Google, Pokemon Company International, Spark Capital",770,9000,2017,8230
Ninja Van,9/27/2021,"Supply chain, logistics, & delivery",Singapore,Singapore,Asia,2014,"B Capital Group, Monk's Hill Ventures, Dynamic Parcel Distribution",975,2000,2021,1025
NIUM,7/13/2021,Fintech,Singapore,Singapore,Asia,2014,"Vertex Ventures SE Asia, Global Founders Capital, Visa Ventures",285,1000,2021,715
NoBroker,11/23/2021,Internet software & services,Bengaluru,India,Asia,2014,"General Atlantic, Elevation Capital, BEENEXT",424,1000,2021,576
Noname Security,12/15/2021,Cybersecurity,Palo Alto,United States,North America,2020,"Insight Partners, Lightspeed Venture Partners, CyberStarts",220,1000,2021,780
Noom,5/24/2021,Health,New York,United States,North America,2006,"Qualcomm Ventures, Samsung Ventures, Silver Lake",657,4000,2021,3343
Northvolt,6/12/2019,Other,Stockholm,Sweden,Europe,2016,"Vattenfall, Volkswagen Group, Goldman Sachs",4000,12000,2019,8000
NotCo,7/26/2021,Artificial Intelligence,Santiago,Chile,South America,2015,"Kaszek Ventures, SOSV, Tiger Global Management",370,2000,2021,1630
Notion Labs,4/1/2020,Internet software & services,San Francisco,United States,North America,2016,"Index Ventures, Draft Ventures, Felicis Ventures",343,10000,2020,9657
NuCom Group,2/22/2018,Other,Unterfoehring,Germany,Europe,2016,General Atlantic,550,2000,2018,1450
Numbrs,8/22/2019,Fintech,Zurich,Switzerland,Europe,1999,"Investment Corporation of Dubai, Centralway",105,1000,2019,895
Nuro,2/11/2019,Auto & transportation,Mountain View,United States,North America,2016,"SoftBank Group, Greylock Partners, Gaorong Capital",2000,9000,2019,7000
Nuvemshop,8/17/2021,E-commerce & direct-to-consumer,Sao Paulo,Brazil,South America,2011,"Kaszek Ventures, Qualcomm Ventures, Accel",628,3000,2021,2372
Nxin,9/18/2018,Internet software & services,Beijing,China,Asia,2015,"Beijing Juneng Hesheng Industry Investment Fund, Beijing Shuju Xinrong Fund",53,1000,2018,947
o9 Solutions,4/28/2020,Artificial Intelligence,Dallas,United States,North America,2009,KKR,417,3000,2020,2583
OakNorth Bank,10/12/2017,Fintech,London,United Kingdom,Europe,2015,"Clermont Group, Coltrane Asset Management, Toscafund Asset Management",1000,3000,2017,2000
OCSiAl,3/4/2019,Other,Leudelange,Luxembourg,Europe,2012,"A&NN, Rusnano",285,2000,2019,1715
Oda,6/2/2021,E-commerce & direct-to-consumer,Oslo,Norway,Europe,2013,"Kinnevik, Softbank Group, Prosus Ventures",337,1000,2021,663
Odoo,7/29/2021,Internet software & services,Louvain-la-Neuve,Belgium,Europe,2005,"Summit Partners, Noshaq, Sofinnova Partners",229,2000,2021,1771
OfBusiness,7/31/2021,E-commerce & direct-to-consumer,Gurgaon,India,Asia,2015,"Matrix Partners India, Falcon Edge Capital, SoftBank Group",734,5000,2021,4266
Offchain Labs,8/31/2021,Internet software & services,Princeton,United States,North America,2018,"Pantera Capital, Polychain Capital, Lightspeed Venture Partners",124,1000,2021,876
Ola Cabs,10/27/2014,Auto & transportation,Bengaluru,India,Asia,2010,"Accel Partners, SoftBank Group, Sequoia Capital",4000,7000,2014,3000
Ola Electric Mobility,7/2/2019,Auto & transportation,Bengaluru,India,Asia,2019,"SoftBank Group, Tiger Global Management, Matrix Partners India",761,5000,2019,4239
Olist,12/15/2021,E-commerce & direct-to-consumer,Curitiba,Brazil,South America,2015,"Redpoint e.ventures, Valor Capital Group, SoftBank Latin America Fund",320,2000,2021,1680
Olive,12/1/2020,Internet software & services,Columbus,United States,North America,2012,"Drive Capital, General Catalyst, Ascension Ventures",856,4000,2020,3144
Omada Health,2/23/2022,Health,San Francisco,United States,North America,2011,"U.S. Venture Partners, dRx Capital, Andreessen Horowitz",449,1000,2022,551
Omio,10/23/2018,Travel,Berlin,Germany,Europe,2013,"Lakestar, Battery Ventures, New Enterprise Associates",396,1000,2018,604
ONE,12/8/2021,Internet software & services,Singapore,Singapore,Asia,2011,"Temasek, Guggenheim Investments, Qatar Investment Authority",515,1000,2021,485
OneTrust,7/11/2019,Internet software & services,Atlanta,United States,North America,2016,Insight Partners,926,5000,2019,4074
Opay,8/23/2021,Fintech,Lagos,Nigeria,Africa,2018,"Sequoia Capital China, Source Code Capital, Redpoint Ventures China",570,2000,2021,1430
OpenAI,7/22/2019,Artificial Intelligence,San Francisco,United States,North America,2015,Khosla Ventures,1000,3000,2019,2000
OpenSea,7/20/2021,E-commerce & direct-to-consumer,New York,United States,North America,2017,"Andreessen Horowitz, Thirty Five Ventures, Sound Ventures",427,13000,2021,12573
Opentrons,9/23/2021,Hardware,New York,United States,North America,2016,"SOSV, Khosla Ventures, Lerer Hippeau",240,2000,2021,1760
OpenWeb,11/9/2021,Internet software & services,New York,United States,North America,2012,"Insight Partners, AltaIR Capital, Norma Investments",223,1000,2021,777
Optimism,3/17/2022,Internet software & services,San Francisco,United States,North America,2019,"Paradigm, Huobi Ventures, Andreessen Horowitz",179,2000,2022,1821
Orbbec Technology,5/21/2018,Hardware,Shenzhen,China,Asia,2013,"R-Z Capital, Green Pine Capital Partners, SAIF Partners China",200,1000,2018,800
Orca Bio,6/17/2020,Health,Menlo Park,United States,North America,2016,"Lightspeed Venture Partners, Data Collective, 8VC",192,1000,2020,808
Orca Security,3/23/2021,Cybersecurity,Portland,United States,North America,2019,"YL Ventures, Redpoint Ventures, GGV Capital",632,1000,2021,368
