Company,Date Joined,Industry,City,Country,Continent,Year Founded,Select Investors, Funds,Valuation,Year Joined,Return
OrCam Technologies,2/20/2018,Artificial Intelligence,Jerusalem,Israel,Asia,2010,"Intel Capital, Aviv Venture Capital",86,1000,2018,914
Orchard,9/9/2021,Fintech,New York,United States,North America,2017,"Accomplice, Juxtapose, FirstMark Capital",252,1000,2021,748
Otto Bock HealthCare,6/24/2017,Health,Duderstadt,Germany,Europe,1919,EQT Partners,0,4000,2017,4000
Oura,4/5/2022,Health,Oulu,Finland,Europe,2013,"Forerunner Ventures, Lifeline Ventures, MSD Capital",148,3000,2022,2852
Outreach,4/16/2019,Internet software & services,Seattle,United States,North America,2011,"Mayfield Fund, M12, Trinity Ventures",489,4000,2019,3511
Outschool,4/14/2021,Edtech,San Francisco,United States,North America,2015,"Uniion Square Ventures, Tiger Global Management, Lightspeed Venture Capital",240,3000,2021,2760
OutSystems,6/5/2018,Internet software & services,Boston,United States,North America,2001,"KKR, ES Ventures, North Bridge Growth Equity",572,10000,2018,9428
Ouyeel,6/27/2019,Internet software & services,Shanghai,China,Asia,2015,Taigang Venture Capital,432,1000,2019,568
OVH,8/15/2016,Other,Roubaix,France,Europe,1999,"KKR, TowerBrook Capital Partners",1000,1000,2016,0
OVO Energy,2/14/2019,Other,Bristol,United Kingdom,Europe,2009,"Mitsubishi Corporation, Mayfair Equity Partners",324,1000,2019,676
Owkin,11/18/2021,Artificial Intelligence,New York,United States,North America,2016,"Google Ventures, Cathay Innovation, NJF Capital",254,1000,2021,746
OwnBackup,1/28/2021,Data management & analytics,Englewood Cliffs,United States,North America,2015,"Insight Partners, Salesforce Ventures, Vertex Ventures",507,3000,2021,2493
OYO Rooms,9/25/2018,Travel,Gurugram,India,Asia,2012,"SoftBank Group, Sequoia Capital India,Lightspeed India Partners",3000,10000,2018,7000
Pacaso,3/24/2021,Fintech,Cincinnati,United States,North America,2020,"Global Founders Capital, Shea Ventures, Greycroft",217,2000,2021,1783
Pagaya,6/17/2020,Fintech,Tel Aviv,Israel,Asia,2015,"Oak HC/FT Partners, GF Investments, Harvey Golub Family Office",417,2000,2020,1583
PandaDoc,9/22/2021,Internet software & services,San Francisco,United States,North America,2016,"Rembrandt Venture Partners, M12, Altos Ventures",510,1000,2021,490
Pantheon Systems,7/13/2021,Internet software & services,San Francisco,United States,North America,2010,"Foundry Group, Scale Venture Partners, SoftBank Group",200,2000,2021,1800
Panther Labs,12/2/2021,Cybersecurity,San Francisco,United States,North America,2018,"Innovation Endeavors, s28 Capital, Lightspeed Venture Partners",141,1000,2021,859
Papa,11/4/2021,Health,Miami,United States,North America,2016,"Initialized Capital, Canaan Partners, Sound Ventures",241,1000,2021,759
Papaya Global,3/4/2021,Internet software & services,New York,United States,North America,2016,"Bessemer Venture Partners, Insight Partners, New Era Ventures",440,4000,2021,3560
Paradox,12/27/2021,Internet software & services,Scottsdale,United States,North America,2016,"Brighton Park Capital, Blue Cloud Ventures, Workday Ventures",253,2000,2021,1747
Pat McGrath Labs,7/16/2018,Consumer & retail,New York,United States,North America,2016,"One Luxury Group, Eurazeo",60,1000,2018,940
Patreon,9/2/2020,Internet software & services,San Francisco,United States,North America,2013,"Index Ventures, Thrive Capital, CRV",413,4000,2020,3587
PatSnap,3/16/2021,Internet software & services,Singapore,Singapore,Asia,2007,"Sequoia Capital China, Shunwei Capital Partners, Qualgro",352,1000,2021,648
Pattern,10/6/2021,Internet software & services,Lehi,United States,North America,2013,"Knox Lane, Ainge Advisory, Carlson Private Capital Partners",277,2000,2021,1723
PAX,10/22/2018,Consumer & retail,San Francisco,United States,North America,2007,"Tao Capital Partners, Global Asset Capital, Tiger Global Management",542,2000,2018,1458
Paxos,4/29/2021,Fintech,New York,United States,North America,2012,"Liberty City Ventures, RRE Ventures, Mithril Capital Management",538,2000,2021,1462
PayFit,1/6/2022,Fintech,London,United Kingdom,Europe,2016,"Accel, frst, Kima Ventures",496,2000,2022,1504
Payhawk,2/14/2022,Fintech,London,United Kingdom,Europe,2018,"Earlybird Venture Capital, Eleven Ventures, QED Investors",239,1000,2022,761
Pendo,10/17/2019,Internet software & services,Raleigh,United States,North America,2013,"Contour Venture Partners, Battery Ventures, Core Capital Partners",357,3000,2019,2643
Pentera,1/11/2022,Cybersecurity,Petah Tikva,Israel,Asia,2015,"AWZ Ventures, Blackstone, Insight Partners",190,1000,2022,810
People.ai,8/11/2021,Internet software & services,San Francisco,United States,North America,2017,"GGV Capital, Lightspeed Venture Partners, ICONIQ Capital",200,1000,2021,800
Persona,9/15/2021,Cybersecurity,San Francisco,United States,North America,2018,"Coatue Management, Index Ventures, Founders Fund",218,2000,2021,1782
Personio,1/19/2021,Internet software & services,Munich,Germany,Europe,2015,"Global Founders Capital, Nortzone Ventures, Picus Capital",524,6000,2021,5476
Pet Circle,12/6/2021,E-commerce & direct-to-consumer,Alexandria,Australia,Oceania,2011,"Prysm Capital, Baillie Gifford & Co., TDM Growth Partners",125,1000,2021,875
Phantom,1/31/2022,Fintech,San Francisco,United States,North America,2021,"Paradigm, Andreessen Horowitz, Jump Capital",118,1000,2022,882
Pharmapacks,11/12/2020,E-commerce & direct-to-consumer,Islandia,United States,North America,2010,The Carlyle Group,433,1000,2020,567
Phenom People,4/7/2021,Internet software & services,Ambler,United States,North America,2011,"Sierra Ventures, AXA Venture Partners, Sigma Prime Ventures",163,1000,2021,837
PicsArt,8/26/2021,Mobile & telecommunications,San Francisco,United States,North America,2011,"Sequoia Capital, DCM Ventures, Insight Partners",195,1000,2021,805
Pilot.com,3/26/2021,Fintech,San Francisco,United States,North America,2016,"Index Ventures, Sequoia Capital, Bezos Expeditions",161,1000,2021,839
Pine Labs,1/24/2020,Fintech,Noida,India,Asia,1998,"Sequoia Capital India, Temasek, PayPal Ventures",903,5000,2020,4097
Pipa Coding,3/25/2021,Edtech,Beijing,China,Asia,2017,"Source Code Capital, XVC Venture Capital, Hillhouse Capital Management",268,1000,2021,732
Pipe,5/19/2021,Fintech,Miami,United States,North America,2019,"next47, MaC Venture Capital, FinVC",566,2000,2021,1434
PLACE,11/17/2021,Internet software & services,Bellingham,United States,North America,2020,"Goldman Sachs Asset Management, 3L",100,1000,2021,900
Placer.ai,1/12/2022,Artificial Intelligence,Los Altos,United States,North America,2016,"Fifth Wall Ventures, JBV Capital, Array Ventures",166,1000,2022,834
Plaid,12/11/2018,Fintech,San Francisco,United States,North America,2012,"New Enterprise Associates, Spar Capital, Index Ventures",734,13000,2018,12266
Playco,9/21/2020,Other,Tokyo,Japan,Asia,2020,"Sozo Ventures, Caffeinated Capital, Sequoia Capital",140,1000,2020,860
Pleo,7/6/2021,Fintech,Copenhagen,Denmark,Europe,2015,"Creandum, Founders, Kinnevik",428,5000,2021,4572
Plume,2/23/2021,Internet software & services,Palo Alto,United States,North America,2015,"Insight Partners, Jackson Square Ventures, Liberty Gloval Ventures",722,3000,2021,2278
Podium,4/7/2020,Internet software & services,Lehi,United States,North America,2014,"Accel, Summit Partners, Google Ventures",419,3000,2020,2581
PointClickCare,1/7/2021,Internet software & services,Mississauga,Canada,North America,2000,"Dragoneer Investment Group, Hellman & Friedman, JMI Equity",230,4000,2021,3770
Poizon,4/29/2019,Mobile & telecommunications,Shanghai,China,Asia,2015,"DST Global, Sequoia Capital China, Gaorong Capital",592,1000,2019,408
PolicyBazaar,5/6/2019,Fintech,Gurgaon,India,Asia,2008,"Info Edge, Softbank Capital",634,2000,2019,1366
Pony.ai,7/11/2018,Artificial Intelligence,Fremont,United States,North America,2016,"Sequoia Capital China, IDG Capital, DCM Ventures",1000,9000,2018,8000
Postman,6/11/2020,Internet software & services,San Francisco,United States,North America,2014,"Nexus Venture Partners, CRV, Insight Partners",433,6000,2020,5567
PPRO,1/19/2021,Fintech,London,United Kingdom,Europe,2006,"Wellington Management, Eurazeo, Citi Ventures",370,1000,2021,630
Preferred Networks,5/17/2018,Artificial Intelligence,Tokyo,Japan,Asia,2014,"Toyota Motor Corporation, Mizuho Financial Group, FANUC",147,2000,2018,1853
Prime Medicine,7/13/2021,Health,Cambridge,United States,North America,2019,"Newpath Partners, Google Ventures, F-Prime Capital",315,1000,2021,685
Printful,5/24/2021,Other,Charlotte,United States,North America,2016,Bregal Sagemount,130,1000,2021,870
Pristyn Care,12/7/2021,Health,Gurugram,India,Asia,2018,"Sequoia Capital India, Hummingbird Ventures, Epiq Capital",177,1000,2021,823
Productboard,2/2/2022,Internet software & services,San Francisco,United States,North America,2014,"Index Ventures, Kleiner Perkins Caufield & Byers, Bessemer Venture Partners",261,2000,2022,1739
Project44,6/1/2021,"Supply chain, logistics, & delivery",Chicago,United States,North America,2014,"Emergence Capital Partners, 8VC, Chicago Ventures",818,3000,2021,2182
Promasidor Holdings,11/8/2016,Consumer & retail,Bryanston,South Africa,Asia,1979,"IFC, Ajinomoto",556,2000,2016,1444
PsiQuantum,7/27/2021,Hardware,Palo Alto,United States,North America,2016,"Playground Global, M12, BlackRock",665,3000,2021,2335
Public,2/17/2021,Fintech,New York,United States,North America,2008,"Accel, Greycroft, Advancit Capital",309,1000,2021,691
Qingting FM,6/2/2021,Internet software & services,Shanghai,China,Asia,2011,"China Culture Industrial Investment Fund, We Capital, China Minsheng Investment Group",164,1000,2021,836
Qonto,1/11/2022,Fintech,Paris,France,Europe,2016,"Alven Capital, Valar Ventures, Tencent Holdings",704,5000,2022,4296
Qualia,12/21/2020,Fintech,San Francisco,United States,North America,2015,"8VC, Menlo Ventures, Tiger Global Management",160,1000,2020,840
Quantum Metric,1/7/2021,Data management & analytics,Colorado Springs,United States,North America,2015,"Insight Partners, Bain Capital Ventures",226,1000,2021,774
QuintoAndar,9/9/2019,E-commerce & direct-to-consumer,Campinas,Brazil,South America,2012,"Kaszek Ventures, General Atlantic, SoftBank Group",755,5000,2019,4245
Quizlet,5/13/2020,Edtech,San Francisco,United States,North America,2005,"Union Square Ventures, Altos Ventures, Costanoa Ventures",62,1000,2020,938
Qumulo,7/16/2020,Data management & analytics,Seattle,United States,North America,2012,"Madrona Venture Group, Kleiner Perkins Caufield & Byers, Highland Capital Partners",347,1000,2020,653
Quora,4/21/2017,Internet software & services,Mountain View,United States,North America,2009,"Y Combinator, Matrix Partners, Benchmark",226,2000,2017,1774
Rad Power Bikes,10/28/2021,Auto & transportation,Seattle,United States,North America,2007,"Durable Capital Partners, Cercano Management, T. Rowe Price",329,1000,2021,671
Radiology Partners,2/26/2018,Health,El Segundo,United States,North America,2012,"New Enterprise Associates, Starr Investment Holdings",1000,4000,2018,3000
Radius Payment Solutions,11/27/2017,Fintech,Crewe,United Kingdom,Europe,1990,Inflexion Private Equity,200,1000,2017,800
Ramp,3/29/2021,Fintech,New York,United States,North America,2019,"D1 Capital Partners, Stripe, Coatue Management",660,8000,2021,7340
RapidAPI,3/23/2022,Internet software & services,San Francisco,United States,North America,2015,"Green Bay Ventures, M12, Andreessen Horowitz",273,1000,2022,727
Rappi,8/31/2018,"Supply chain, logistics, & delivery",Bogota,Colombia,South America,2015,"DST Global, Andreessen Horowitz, Sequoia Capital, Redpoint e.ventures",2000,5000,2018,3000
Rapyd,12/3/2019,Fintech,London,United Kingdom,Europe,2016,"Target Global, General Catalyst, Durable Capital Partners",770,15000,2019,14230
Razor,11/8/2021,Consumer & retail,Berlin,Germany,Europe,2020,"Global Founders Capital, 468 Capital, Redalpine Venture Partners",167,1000,2021,833
Razorpay,10/11/2020,Fintech,Bengaluru,India,Asia,2013,"Sequoia Capital India, Tiger Global Management, Matrix Partners India",742,8000,2020,7258
Rebel Foods,10/7/2021,E-commerce & direct-to-consumer,Pune,India,Asia,2011,"Sequoia Capital India, Lightbox Ventures, Coatue Management",521,1000,2021,479
Rebellion Defense,9/16/2021,Artificial Intelligence,Washington DC,United States,North America,2019,"Venrock, Innovation Endeavors, Insights Partners",150,1000,2021,850
Rec Room,3/23/2021,Internet software & services,Seattle,United States,North America,2016,"First Round Capital, Sequoia Capital, Index Ventures",294,4000,2021,3706
ReCharge,5/6/2021,Fintech,Los Angeles,United States,North America,2017,"ICONIQ Growth, Bain Capital Ventures, Summit Partners",277,2000,2021,1723
Red Ventures,1/7/2015,Other,Fort Mill,United States,North America,2000,"Silver Lake Partners, General Atlantic",250,1000,2015,750
reddit,7/31/2017,Internet software & services,San Francisco,United States,North America,2005,"Y Combinator, Sequoia Capital, Coatue Management",1000,10000,2017,9000
Redis Labs,8/25/2020,Data management & analytics,Mountain View,United States,North America,2011,"Viola Ventures, Dell Technologies Capital, Bain Capital Ventures",356,2000,2020,1644
Redwood Materials,7/28/2021,Other,Carson City,United States,North America,2017,"Breakthrough Energy Ventures, Capricorn Investment Group, Valor Equity Partners",792,4000,2021,3208
REEF Technology,12/10/2018,"Supply chain, logistics, & delivery",Miami,United States,North America,2015,"Target Global, UBS Asset Management, Mubadala Capital",2000,1000,2018,-1000
Reify Health,8/10/2021,Health,Boston,United States,North America,2012,"Sierra Ventures, Battery Ventures, Asset Management Ventures",259,2000,2021,1741
Relativity,3/18/2021,Internet software & services,Chicago,United States,North America,2001,"Silver Lake, ICONIQ Capital",125,4000,2021,3875
Relativity Space,11/23/2020,Other,Inglewood,United States,North America,2016,"Playground Global, Bond, Tribe Capital",1000,4000,2020,3000
RELEX Solutions,2/17/2022,"Supply chain, logistics, & delivery",Helsinki,Finland,Europe,2005,"Blackstone, Technology Crossover Ventures, Summit Partners",803,6000,2022,5197
ReliaQuest,12/1/2021,Cybersecurity,Tampa,United States,North America,2007,"KKR, FTV Capital, Ten Eleven Ventures",330,1000,2021,670
Reltio,11/4/2021,Data management & analytics,Redwood City,United States,North America,2011,"Crosslink Capital, .406 Ventures, Sapphire Ventures",237,2000,2021,1763
Remote,7/13/2021,Fintech,San Francisco,United States,North America,2016,"Index Ventures, Sequoia Capital, General Catalyst",496,3000,2021,2504
Retool,12/22/2021,Internet software & services,San Francisco,United States,North America,2000,Sequoia Capital,96,2000,2021,1904
Revolut,4/26/2018,Fintech,London,United Kingdom,Europe,2015,"index Ventures, DST Global, Ribbit Capital",2000,33000,2018,31000
Revolution Precrafted,10/23/2017,Other,Manila,Philippines,Asia,2015,"K2 Global, 500 Startups",15,1000,2017,985
RIDI,1/24/2022,E-commerce & direct-to-consumer,Seoul,South Korea,Asia,2008,"Atinum Investment, Company K Partners, GIC",178,1000,2022,822
Rightway,3/30/2021,Health,New York,United States,North America,2017,"Thrive Capital, Khosla Ventures, Tiger Global Management",130,1000,2021,870
Ripple,12/20/2019,Fintech,San Francisco,United States,North America,2012,"IDG Capital, Venture51, Lightspeed Venture Partners",294,10000,2019,9706
Rippling,8/4/2020,Internet software & services,San Francisco,United States,North America,2017,"Initialized Capital, Y Combinator, Kleiner Perkins Caufield & Byers",447,7000,2020,6553
Rivigo,7/11/2019,"Supply chain, logistics, & delivery",Gurgaon,India,Asia,2014,"SAIF Partners India, Warburg Pincus, Trifecta Capital Advisors",247,1000,2019,753
Ro,7/27/2020,Health,New York,United States,North America,2017,"Initialized Capital, General Catalyst, SignalFire",1000,7000,2020,6000
Rohlik,7/1/2021,"Supply chain, logistics, & delivery",Prague,Czech Republic,Europe,2019,"Partech Partners, Index Ventures, Quadrille Capital",380,1000,2021,620
Rokt,12/16/2021,Internet software & services,New York,United States,North America,2012,"Square Peg Capital, TDM Growth Partners, Tiger Global Management",487,2000,2021,1513
Roofstock,3/10/2022,Fintech,Oakland,United States,North America,2015,"Khosla Ventures, Bain Capital Ventures, Lightspeed Venture Partners",365,2000,2022,1635
Rothy's,12/21/2021,Consumer & retail,San Francisco,United States,North America,2016,"Alpargatas, GS Growth, Lightspeed Venture Partners",484,1000,2021,516
Route,1/21/2022,"Supply chain, logistics, & delivery",Lehi,United States,North America,2018,"Madrona Venture Group, Banner Ventures, FJ Labs",482,1000,2022,518
Royole Corporation,8/18/2015,Hardware,Shenzhen,China,Asia,2012,"Warmsun Holding, IDG Capital Partners",492,5000,2015,4508
Rubicon,8/25/2017,Other,Atlanta,United States,North America,2008,"Goldman Sachs, Leonardo DiCaprio, Promecap",223,1000,2017,777
Rubrik,4/28/2017,Data management & analytics,Palo Alto,United States,North America,2014,"Greylock Partners, Lightspeed Venture Partners, Khosla Ventures",553,4000,2017,3447
SafetyCulture,5/3/2021,Internet software & services,Sydney,Australia,Oceania,2004,"Blackbird Ventures, IndexVentures, Tiger Global Management",222,2000,2021,1778
Salt Security,2/10/2022,Cybersecurity,Palo Alto,United States,North America,2016,"Y Combinator, S Capital, Tenaya Capital",271,1000,2022,729
SaltPay,4/9/2021,Fintech,London,United Kingdom,Europe,2019,"Tiger Global Management, Hedosophia",1000,1000,2021,0
SambaNova Systems,4/13/2021,Data management & analytics,Palo Alto,United States,North America,2017,"Walden International, Google Ventures, Intel Capital",1000,5000,2021,4000
Savage X Fenty,2/10/2021,E-commerce & direct-to-consumer,El Segundo,United States,North America,2018,"Speedinvest, Valar Ventures, Uniqa Ventures",310,1000,2021,690
Scalable Capital,6/8/2021,Fintech,Munich,Germany,Europe,2014,"BlackRock, Tengelmann Ventures, Holtzbrinck Ventures",314,1000,2021,686
Scalapay,2/23/2022,Fintech,Milan,Italy,Europe,2019,"Fasanara Capital, Tiger Global Management, Baleen Capital",416,1000,2022,584
Scale AI,8/5/2019,Artificial Intelligence,San Francisco,United States,North America,2018,"Accel, Y Combinator, Index Ventures",603,7000,2019,6397
Scandit,2/9/2022,"Supply chain, logistics, & delivery",Zurich,Switzerland,Europe,2009,"Atomico, NGP Capital, Google Ventures",273,1000,2022,727
Scopely,10/29/2019,Mobile & telecommunications,Culver City,United States,North America,2011,"Greycroft, Sands Capital, Revolution Growth",999,3000,2019,2001
SeekOut,1/12/2022,Internet software & services,Bellevue,United States,North America,2017,"Mayfield, Madrona Venture Group, Tiger Global Management",189,1000,2022,811
Seismic,12/18/2018,Internet software & services,San Diego,United States,North America,2010,"Jackson Square Ventures, General Atlantic, Lightspeed Venture Partners",427,3000,2018,2573
SellerX,12/9/2021,E-commerce & direct-to-consumer,Berlin,Germany,Europe,2020,"Cherry Ventures, Felix Capital, 83North",766,2000,2021,1234
Sendbird,4/6/2021,Mobile & telecommunications,San Mateo,United States,North America,2013,"FundersClub, Y Combinator, Tiger Global Management",221,1000,2021,779
Sennder,1/14/2021,"Supply chain, logistics, & delivery",Berlin,Germany,Europe,2015,"Accelm Scania Growth Capital, Lakestar",340,1000,2021,660
Sentry,2/18/2021,Other,San Francisco,United States,North America,2011,"New Enterprise Associates, Accel, Bond",127,1000,2021,873
ServiceTitan,11/14/2018,Internet software & services,Glendale,United States,North America,2012,"Bessemer Venture Partners, ICONIQ Capital, Battery Ventures",1000,10000,2018,9000
ShareChat,4/8/2021,Internet software & services,Bengaluru,India,Asia,2015,"India Quotient, Elevation Capital, Lightspeed Venture Partners",1000,4000,2021,3000
SHEIN,7/3/2018,E-commerce & direct-to-consumer,Shenzhen,China,Asia,2008,"Tiger Global Management, Sequoia Capital China, Shunwei Capital Partners",2000,100000,2018,98000
Shield AI,8/24/2021,Artificial Intelligence,San Diego,United States,North America,2015,"Andreessen Horowitz, Homebrew, Point72 Ventures",328,1000,2021,672
Shift Technology,5/6/2021,Artificial Intelligence,Paris,France,Europe,2014,"Griffin Gaming Partners, Andreessen Horowitz, Battery Ventures",545,1000,2021,455
ShipBob,6/29/2021,"Supply chain, logistics, & delivery",Chicago,United States,North America,2014,"Hyde Park Venture Partners, FundersClub, Bain Capital Ventures",331,1000,2021,669
Shippo,6/2/2021,"Supply chain, logistics, & delivery",San Francisco,United States,North America,2013,"Version One Ventures, Uncork Capital, Bessemer Venture Partners",154,1000,2021,846
Shukun Technology,8/16/2021,Artificial Intelligence,Beijing,China,Asia,2017,"Marathon Venture Partners, Huagai Capital, China Creation Ventures",211,1000,2021,789
Shulan Health,3/1/2021,Health,Hangzhou,China,Asia,2015,Qiming Venture Partners,43,1000,2021,957
Side,3/22/2021,Internet software & services,San Francisco,United States,North America,2017,"Coatue Managemeny, Trinity Ventures, Matrix Partners",314,3000,2021,2686
Sidecar Health,1/26/2021,Fintech,El Segundo,United States,North America,2018,"GreatPoint Ventures, Tiger Global Management, Menlo Ventures",163,1000,2021,837
SiFive,3/16/2022,Hardware,San Mateo,United States,North America,2015,"Sutter Hill Ventures, Osage University Partners, Spark Capital",366,3000,2022,2634
Sift,4/22/2021,Artificial Intelligence,San Francisco,United States,North America,2011,"Union Square Ventures, Insight Partners, Spark Capital",157,1000,2021,843
Signifyd,4/15/2021,Fintech,San Jose,United States,North America,2011,"Menlo Ventures, Resolute Ventures, IA Ventures",390,1000,2021,610
Sila Nanotechnologies,4/16/2019,Other,Alameda,United States,North America,2011,"Bessemer Venture Partners, Sutter Hill Ventures, Matrix Partners",880,3000,2019,2120
Sisense,1/9/2020,Data management & analytics,New York,United States,North America,2004,"Opus Capital, Genesis Partners, Battery Ventures",274,1000,2020,726
SITECH DEV,5/16/2019,Other,Guiyang,China,Asia,2017,China Prosperity Capital,523,1000,2019,477
Skims,4/9/2021,E-commerce & direct-to-consumer,Los Angeles,United States,North America,2019,"Thrive Capital, Alliance Consumer Growth, Imaginary Ventures",399,3000,2021,2601
Sky Mavis,10/4/2021,Internet software & services,Ho Chi Minh City,Vietnam,Asia,2019,"Fabric Ventures, 500 Global, Standard Crypto",311,3000,2021,2689
Skydance Media,2/11/2020,Other,Santa Monica,United States,North America,2010,"RedBird Capital Partners, CJ ENM, Tencent Holdings",275,2000,2020,1725
Skydio,2/25/2021,"Supply chain, logistics, & delivery",Redwood City,United States,North America,2014,"Andreessen Horowitz, Andreessen Horowitz, Institutional Venture Partners, Accel",340,1000,2021,660
Slice,11/28/2021,Fintech,Bengaluru,India,Asia,2015,"Gunosy Capital, Blume Ventures, Das Capital",249,1000,2021,751
SmartAsset,6/24/2021,Fintech,New York,United States,North America,2012,"Javelin Venture Partners, TTV Capital, Peterson Ventures",161,1000,2021,839
SmartHR,6/8/2021,Fintech,Tokyo,Japan,Asia,2013,"BEENEXT, World Innovation Lab, Light Street Capital",190,2000,2021,1810
SmartMore,6/24/2021,Artificial Intelligence,Shenzhen,China,Asia,2019,"IDG Capital, ZhenFund, Sequoia Capital China",300,1000,2021,700
SmartNews,8/5/2019,Mobile & telecommunications,Tokyo,Japan,Asia,2012,"Japan Post Capital, Globis Capital Partners, Atomico",410,2000,2019,1590
SmartRecruiters,7/20/2021,Internet software & services,San Francisco,United States,North America,2010,"Mayfield Fund, Insight Partners, Rembrandt Venture Partners",225,2000,2021,1775
SMS Assist,6/7/2016,Internet software & services,Chicago,United States,North America,2003,"Goldman Sachs, Insights Venture Partners, Pritzker Group Venture Capital",255,1000,2016,745
Snapdeal,5/21/2014,E-commerce & direct-to-consumer,New Delhi,India,Asia,2008,"SoftBankGroup, Blackrock, Alibaba Group",2000,1000,2014,-1000
Snapdocs,5/25/2021,Fintech,San Francisco,United States,North America,2012,"Sequoia Capital, Y Combinator, F-Prime Capital",253,2000,2021,1747
SnapLogic,12/13/2021,Internet software & services,San Mateo,United States,North America,2006,"Andreessen Horowitz, Triangle Peak Partners, Ignition Partners",371,1000,2021,629
Snorkel AI,8/9/2021,Artificial Intelligence,Palo Alto,United States,North America,2019,"Greylock Partners, Google Ventures, BlackRock",135,1000,2021,865
Snyk,1/21/2020,Cybersecurity,Boston,United States,North America,2015,"BOLDstart Ventures, Google Ventures, Accel",1000,9000,2020,8000
Socar,10/16/2020,Auto & transportation,Jeju-do,South Korea,Asia,2012,"Bain Capital, Altos Ventures, Songhyun Investment",408,1000,2020,592
Socure,3/16/2021,Cybersecurity,New York,United States,North America,2012,"Two Sigma Ventures, Flint Capital, Commerce Ventures",644,5000,2021,4356
solarisBank,7/13/2021,Fintech,Berlin,Germany,Europe,2016,"Yabeo Capital, SBI Investment, Vulcan Capital",403,2000,2021,1597
Solo.io,10/7/2021,Internet software & services,Cambridge,United States,North America,2017,"True Ventures, Altimeter Capital, Redpoint Ventures",172,1000,2021,828
Solugen,9/10/2021,Other,Houston,United States,North America,2016,"Fifty Years Fund, Refactor Capital, Temasek",435,2000,2021,1565
Somatus,2/23/2022,Health,McLean,United States,North America,2016,"The Blue Venture Fund, Flare Capital Partners, Longitude Capital",465,3000,2022,2535
SonderMind,7/28/2021,Health,Denver,United States,North America,2014,"Kickstart Fund, General Catalyst, Drive Capital",183,1000,2021,817
Sorare,9/21/2021,E-commerce & direct-to-consumer,Paris,France,Europe,2019,"Benchmark, Accel, SoftBank Group",739,4000,2021,3261
