Company,Date Joined,Industry,City,Country,Continent,Year Founded,Select Investors, Funds,Valuation,Year Joined,Return
1047 Games,9/14/2021,Internet software & services,Zephyr Cove,United States,North America,2017,"VGames, Lakestar, Galaxy Interactive",127,2000,2021,1873
1KMXC,8/30/2021,Hardware,Hangzhou,China,Asia,2014,"Goldman Sachs Asset Management, SDP Investment, Alibaba Group",86,1000,2021,914
1Password,7/8/2021,Cybersecurity,Toronto,Canada,North America,2005,"Slack Fund, Accel, Skip Capital",920,7000,2021,6080
4Paradigm,12/19/2018,Artificial Intelligence,Beijing,China,Asia,2015,"Sequoia Capital China, China Construction Bank, Bank of China",1000,2000,2018,1000
56PINGTAI,1/25/2021,"Supply chain, logistics, & delivery",Shanghai,China,Asia,2013,"QF Capital, QC Capital, Unicom Innovation Venture Capital",188,1000,2021,812
58 Daojia,10/12/2015,Internet software & services,Beijing,China,Asia,2014,"KKR, Alibaba Group, Ping An Insurance",300,1000,2015,700
6Sense,3/30/2021,Artificial Intelligence,San Francisco,United States,North America,2013,"Venrock, Battery Ventures, Insight Partners",426,5000,2021,4574
A24 Films,3/9/2022,Other,New York,United States,North America,2012,"Stripes Group, Neuberger Berman",225,3000,2022,2775
ABL Space Systems,3/25/2021,Other,El Segundo,United States,North America,2017,"T. Rowe Price, Lockheed Martin Ventures, Fidelity Investment",419,2000,2021,1581
Abogen,11/29/2021,Health,Suzhou,China,Asia,2019,"Hillhouse Capital Management, SoftBank Group, Qiming Venture Partners",1000,4000,2021,3000
Accelerant,1/12/2022,Other,Colchester,United Kingdom,Europe,2018,"Deer Park Road, Altamont Capital Partners, Eldridge",193,2000,2022,1807
Acko General Insurance,10/28/2021,Fintech,Bengaluru,India,Asia,2016,"Intact Ventures, Munich Re Ventures, General Atlantic",458,1000,2021,542
Acorns,3/9/2022,Fintech,Irvine,United States,North America,2012,"e.ventures, Bain Capital Ventures, Greycroft",507,2000,2022,1493
Acronis,9/18/2019,Cybersecurity,Schaffhausen,Switzerland,Europe,2003,"Goldman Sachs, VebVentures, Insight Partners",408,3000,2019,2592
ActiveCampaign,4/21/2021,Internet software & services,Chicago,United States,North America,2003,"Silversmith Capital Partners, Susquehanna Growth Equity, Tiger Global Management",360,3000,2021,2640
Ada Support,5/7/2021,Artificial Intelligence,Toronto,Canada,North America,2016,"Version One Ventures, Bessemer Venture Partners, FirstMark Capital",191,1000,2021,809
Addepar,6/15/2021,Fintech,Mountain View,United States,North America,2009,"8VC, D1 Capital Partners, Sway Ventures",676,2000,2021,1324
Advance Intelligence Group,9/23/2021,Artificial Intelligence,Singapore,Singapore,Asia,2016,"Vision Plus Capital, GSR Ventures, ZhenFund",536,2000,2021,1464
Afiniti,4/14/2017,Artificial Intelligence,Hamilton,Bermuda,North America,2006,GAM Holding,120,2000,2017,1880
Age of Learning,5/3/2016,Edtech,Glendale,United States,North America,2007,Iconiq Capital,500,3000,2016,2500
AgentSync,12/7/2021,Fintech,Denver,United States,North America,2018,"Craft Ventures, Caffeinated Capital, Operator Collective",111,1000,2021,889
Agile Robots,9/9/2021,Hardware,Munich,Germany,Europe,2018,"Hillhouse Capital Management, Sequoia Capital China, Linear Venture",240,1000,2021,760
Aibee,4/13/2021,Artificial Intelligence,Beijing,China,Asia,2017,"Sequoia Capital China, Lenovo Capital and Incubator, Group GSR Ventures",273,1000,2021,727
Airbyte,12/17/2021,Internet software & services,San Francisco,United States,North America,2020,"Accel, Benchmark, SV Angel",181,2000,2021,1819
Aircall,6/23/2021,Internet software & services,New York,United States,North America,2014,"Balderton Capital, Next World Capital, Draper Esprit",226,1000,2021,774
Airtable,11/15/2018,Internet software & services,San Francisco,United States,North America,2013,"Caffeinated Capital, CRV, Founder Collective",1000,12000,2018,11000
Airwallex,3/25/2019,Fintech,Melbourne,Australia,Oceania,2015,"DST Global, Sequoia Capital China, Tencent Holdings",802,6000,2019,5198
Aiven,10/18/2021,Internet software & services,Helsinki,Finland,Europe,2016,"Institutional Venture Partners, Atomico, Earlybird Venture Capital",210,2000,2021,1790
AIWAYS,4/16/2018,Auto & transportation,Shanghai,China,Asia,2017,"Jiangsu Sha Steel Group, Shanghai Puyin Industry, Funa Yuanchuang Technology",792,2000,2018,1208
Ajaib,10/4/2021,Fintech,Jakarta,Indonesia,Asia,2018,"Softbank Ventures Asia, Alpha JWC Ventures, Insignia Ventures Partners",245,1000,2021,755
Akulaku,2/15/2022,E-commerce & direct-to-consumer,Jakarta,Indonesia,Asia,2014,"DCM Ventures, IDG Capital, Siam Commercial Bank",438,2000,2022,1562
Alan,4/19/2021,Fintech,Paris,France,Europe,2016,"Index Ventures, Temasek, Portag3 Ventures",364,2000,2021,1636
Alation,6/3/2021,Internet software & services,Redwood City,United States,North America,2012,"Costanoa Ventures, Data Collective, Salesforce Ventures",192,1000,2021,808
Alchemy,10/28/2021,Fintech,San Francisco,United States,North America,2017,"DFJ Growth Fund, Coatue Management, Addition",564,10000,2021,9436
Aledade,1/19/2021,Health,Bethesda,United States,North America,2014,"Venrock, CVF Capital Partners, ARCH Venture Partners",295,2000,2021,1705
Aleo,2/7/2022,Cybersecurity,San Francisco,United States,North America,2019,"Slow Ventures, Andreessen Horowitz, SoftBank Group",228,1000,2022,772
Algolia,7/28/2021,Internet software & services,San Francisco,United States,North America,2012,"Accel, Alven Capital, Storm Ventures",334,2000,2021,1666
Alloy,9/30/2021,Fintech,New York,United States,North America,2015,"Bessemer Venture Partners, Eniac Ventures, Canapi Ventures",156,1000,2021,844
Alto Pharmacy,1/30/2020,Health,San Francisco,United States,North America,2015,"Jackson Square Ventures, Greenoaks Capital Management, Softbank Group",524,1000,2020,476
Alzheon,9/30/2020,Health,Framingham,United States,North America,2013,"ARCH Venture Partners, Ally Bridge Group",94,1000,2020,906
Amagi,3/16/2022,Internet software & services,Bengaluru,India,Asia,2008,"Mayfield, Accel, Norwest Venture Partners",240,1000,2022,760
Amber Group,6/21/2021,Fintech,Hong Kong,Hong Kong,Asia,2015,"Tiger Global Management, Tiger Brokers, DCM Ventures",328,3000,2021,2672
Amount,5/17/2021,Fintech,Chicago,United States,North America,2019,"Invus Group, Hanaco Venture Capital, WestCap Group",243,1000,2021,757
Amperity,7/13/2021,Artificial Intelligence,Seattle,United States,North America,2016,"Madrona Venture Group, Tiger Global Management, Madera Technology Partners",187,1000,2021,813
Anchorage Digital,12/15/2021,Fintech,San Francisco,United States,North America,2017,"Andreessen Horowitz, Blockchain Capital, Lux Capital",487,3000,2021,2513
Andela,9/29/2021,Internet software & services,New York,United States,North America,2014,"Spark Capital, Google Ventures, CRE Venture Capital",381,2000,2021,1619
Anduril,9/11/2019,Artificial Intelligence,Irvine,United States,North America,2017,"Andreessen Horowitz, Founders Fund, Revolution Ventures",691,5000,2019,4309
Ankorstore,1/10/2022,E-commerce & direct-to-consumer,Paris,France,Europe,2019,"Global Founders Capital, Aglae Ventures, Alven Capital",422,2000,2022,1578
Anyscale,12/7/2021,Artificial Intelligence,Berkeley,United States,North America,2019,"Andreessen Horowitz, Intel Capital, Foundation Capital",160,1000,2021,840
Apeel Sciences,5/26/2020,Other,Goleta,United States,North America,2012,"Upfront Ventures, Tao Capital Partners, Andreessen Horowitz",640,2000,2020,1360
apna,9/15/2021,Internet software & services,Bengaluru,India,Asia,2019,"Sequoia Capital India, Rocketship.vc, Lightspeed India Partners",193,1000,2021,807
AppDirect,10/7/2015,E-commerce & direct-to-consumer,San Francisco,United States,North America,2009,"Mithril, iNovia Capital, Foundry Group",431,2000,2015,1569
Applied Intuition,10/22/2020,Data management & analytics,Sunnyvale,United States,North America,2017,"Andreessen Horowitz, Lux Capital, General Catalyst",352,4000,2020,3648
ApplyBoard,5/5/2020,Edtech,Kitchener,Canada,North America,2015,"Artiman Ventures, Plug and Play Ventures, Anthos Capital",483,3000,2020,2517
AppsFlyer,1/21/2020,Mobile & telecommunications,San Francisco,United States,North America,2011,"Magma Venture Partners, Pitango Venture Capital, Qumra Capital",293,2000,2020,1707
Aprogen,5/31/2019,Health,Seongnam-Si,South Korea,Asia,2000,"Lindeman Asia Investment, Nichi-Iko Pharmaceutical",62,1000,2019,938
Aptos,3/15/2022,Internet software & services,Palo Alto,United States,North America,2021,"Andreessen Horowitz, Coinbase Ventures, Tiger Global Management",200,1000,2022,800
Apus Group,1/16/2015,Mobile & telecommunications,Beijing,China,Asia,2014,"Redpoint Ventures, QiMing Venture Partners, Chengwei Capital",116,1000,2015,884
Aqua Security,3/10/2021,Cybersecurity,Ramat Gan,Israel,Asia,2015,"TLV Partners, Lightspeed Venture Partners, M12",265,1000,2021,735
Arctic Wolf Networks,10/22/2020,Cybersecurity,Eden Prairie,United States,North America,2012,"Lightspeed Venture Partners, Redpoint Ventures, Viking Global Investors",498,4000,2020,3502
Argo AI,7/12/2019,Artificial Intelligence,Pittsburgh,United States,North America,2016,"Volkswagen Group, Ford Autonomous Vehicles",4000,12000,2019,8000
Articulate,7/1/2021,Edtech,New York,United States,North America,2015,"Blackstone, ICONIQ Growth, General Atlantic",2000,4000,2021,2000
ASAPP,5/19/2021,Artificial Intelligence,New York,United States,North America,2014,"March Capital Partners, HOF Capital, Emergence Capital Partners",380,2000,2021,1620
Ascend Money,9/27/2021,Fintech,Bangkok,Thailand,Asia,2013,"Ant Group, Charoen Pokphand Group, Bow Wave Capital",150,2000,2021,1850
Assembly,9/21/2021,Internet software & services,Culver City,United States,North America,2019,"Advent International, PSG, Providence Equity Partners",524,1000,2021,476
Assent,1/6/2022,"Supply chain, logistics, & delivery",Ottawa,Canada,North America,2010,"Vista Equity Partners, Warburg Pincus, First Ascent Ventures",534,1000,2022,466
Astranis Space Technologies,4/14/2021,Mobile & telecommunications,San Francisco,United States,North America,2015,"Refactor Capital, Andreessen Horowitz, Fifty Years Fund",303,1000,2021,697
At-Bay,7/27/2021,Fintech,Mountain View,United States,North America,2016,"Lightspeed Venture Partners, Khosla Ventures, Munich Re Ventures",292,1000,2021,708
Athelas,1/31/2022,Health,Mountain View,United States,North America,2016,"Sequoia Capital, General Catalyst, Human Capital",150,2000,2022,1850
Athletic Greens,1/25/2022,Health,New York,United States,North America,2010,"SC.Holdings, Not Boring Capital, Bolt Ventures",115,1000,2022,885
Attentive,9/23/2020,Mobile & telecommunications,Hoboken,United States,North America,2016,"NextView Ventures, Eniac Ventures, Sequoia Capital",863,7000,2020,6137
Augury,10/26/2021,Artificial Intelligence,New York,United States,North America,2011,"Lerer Hippeau, Munich Re Ventures, Eclipse Ventures",294,1000,2021,706
Aura,6/9/2021,Cybersecurity,Burlington,United States,North America,2019,"Warburg Pincus, General Catalyst",500,3000,2021,2500
Aurora Solar,5/24/2021,Internet software & services,San Francisco,United States,North America,2013,"Fifth Wall Ventures, Energize Ventures, ICONIQ Capital",523,4000,2021,3477
Automation Anywhere,7/2/2018,Artificial Intelligence,San Jose,United States,North America,2003,"General Atlantic, Goldman Sachs, New Enterprise Associates",849,7000,2018,6151
Automattic,5/27/2013,Internet software & services,San Francisco,United States,North America,2005,"Insight Venture Partners, Lowercase Capital, Polaris Partners",859,3000,2013,2141
Avant,12/17/2012,Artificial Intelligence,Chicago,United States,North America,2012,"RRE Ventures, Tiger Global, August Capital",658,2000,2012,1342
Aviatrix,9/8/2021,Internet software & services,Santa Clara,United States,North America,2014,"Ignition Partners, Formation 8, CRV",341,2000,2021,1659
Away,5/15/2019,E-commerce & direct-to-consumer,New York,United States,North America,2015,"Global Founders Capital, Comcast Ventures, Forerunner Ventures",181,1000,2019,819
Axelar,2/15/2022,Internet software & services,Waterloo,Canada,North America,2020,"Lemniscap VC, North Island Ventures, Polychain Capital",64,1000,2022,936
Axiom Space,2/16/2021,Other,Houston,United States,North America,2016,"C5 Capital, Hemisphere Ventures, The Venture Collective",150,1000,2021,850
Axonius,3/1/2021,Cybersecurity,New York,United States,North America,2017,"Vertex Ventures Israel, Bessemer Venture Partners, Emerge",395,3000,2021,2605
Axtria,5/13/2021,Data management & analytics,Berkeley Heights,United States,North America,2009,"Helion Venture Partners, Bain Capital Tech Opportunities, Sequoia Capital India",206,1000,2021,794
Back Market,5/18/2021,E-commerce & direct-to-consumer,Paris,France,Europe,2014,"Aglae Ventures, Eurazeo, Daphni",1000,6000,2021,5000
Baiwang,3/25/2019,Fintech,Beijing,China,Asia,2015,"Guozhong Venture Capital Management, Shenzhen Capital Group, Oriental Fortune Capital",224,2000,2019,1776
Banma Network Technologies,9/13/2018,Auto & transportation,Shanghai,China,Asia,2015,"Yunfeng Capital, SDIC Innovation Investment Management, Shang Qi Capital",697,1000,2018,303
BeiBei,1/22/2015,E-commerce & direct-to-consumer,Hangzhou,China,Asia,2011,"Banyan Capital, New Horizon Capital, IDG Capital Partners",224,1000,2015,776
Beisen,5/11/2021,Internet software & services,Beijing,China,Asia,2002,"Matrix Partners China, Sequoia Capital China, Genesis Capital",388,1000,2021,612
Benchling,4/14/2021,Internet software & services,San Francisco,United States,North America,2012,"Thrive Capital, Benchmark, MenloVentures",412,6000,2021,5588
BenevolentAI,6/2/2015,Artificial Intelligence,London,United Kingdom,Europe,2013,Woodford Investment Management,292,1000,2015,708
Berlin Brands Group,9/1/2021,E-commerce & direct-to-consumer,Berlin,Germany,Europe,2005,"Ardian, Bain Capital",800,1000,2021,200
Better.com,11/10/2020,Fintech,New York,United States,North America,2018,"Pine Brook, American Express Ventures, Kleiner Perkins Caufield & Byers",405,6000,2020,5595
Betterfly,2/1/2022,Artificial Intelligence,Santiago,Chile,South America,2018,"QED Investors, DST Global, Endeavor",205,1000,2022,795
Betterment,9/29/2021,Fintech,New York,United States,North America,2010,"Bessemer Venture Partners, Menlo Ventures, Anthermis",335,1000,2021,665
BetterUp,2/25/2021,Internet software & services,San Francisco,United States,North America,2013,"Threshold Ventures, Lightspeed Venture Partners, Crosslink Capital",567,5000,2021,4433
Beyond Identity,2/22/2022,Cybersecurity,New York,United States,North America,2019,"New Enterprise Associates, Koch Disruptive Technologies, Evolution Equity Partners",205,1000,2022,795
BGL Group,11/24/2017,Fintech,Peterborough,United Kingdom,Europe,1992,CPP Investment Board,696,2000,2017,1304
BharatPe,7/30/2021,Fintech,New Delhi,India,Asia,2018,"Insight Partners, Sequoia Capital India, BEENEXT",600,3000,2021,2400
BigID,12/16/2020,Cybersecurity,New York,United States,North America,2015,"BOLDstart Ventures, SAP.iO Fund, Scale Venture Partners",246,1000,2020,754
BigPanda,1/12/2022,Artificial Intelligence,Mountain View,United States,North America,2012,"Advent International, Battery Ventures, Sequoia Capital Israel",317,1000,2022,683
Biosplice Therapeutics,8/6/2018,Health,San Diego,United States,North America,2008,"Vickers Venture Partners, IKEA GreenTech",799,12000,2018,11201
Biren Technology,8/18/2020,Hardware,Shanghai,China,Asia,2019,"V FUND, IDG Capital, Green Pine Capital Partners",285,2000,2020,1715
BitFury,11/6/2018,Hardware,Amsterdam,Netherlands,Europe,2011,"Georgian Co-Investment Fund, iTech Capital, Galaxy Digital",170,1000,2018,830
Bitmain,7/6/2018,Hardware,Beijing,China,Asia,2015,"Coatue Management, Sequoia Capital China, IDG Capital",765,12000,2018,11235
BitPanda,3/16/2021,Fintech,Vienna,Austria,Europe,2014,"Speedinvest, Valar Ventures, Uniqa Ventures",546,4000,2021,3454
BitSight Technologies,9/13/2021,Cybersecurity,Boston,United States,North America,2013,"Menlo Ventures, GGV Capital, Flybridge Capital Partners",401,2000,2021,1599
Bitso,5/5/2021,Fintech,Mexico City,Mexico,North America,2014,"Pantera Capital, QED Investors, Coinbase Ventures",378,2000,2021,1622
BlaBlaCar,9/16/2015,Auto & transportation,Paris,France,Europe,2006,"Accel Partners, Index Ventures, Insight Venture Partners",449,2000,2015,1551
Black Sesame Technologies,9/22/2021,Artificial Intelligence,Shanghai,China,Asia,2016,"Northern Light Venture Capital, Xiaomi, FutureX Capital",115,2000,2021,1885
Black Unicorn Factory,5/20/2021,Other,Los Angeles,United States,North America,2020,Barter Ventures,645,6000,2021,5355
BlackBuck,7/22/2021,"Supply chain, logistics, & delivery",Bengaluru,India,Asia,2015,"Accel, Sands Capital, International Finance Corporation",352,1000,2021,648
Blockchain.com,2/17/2021,Fintech,London,United Kingdom,Europe,2011,"Lightspeed Venture Partners, Google Ventures, Lakestar",490,14000,2021,13510
BlockDaemon,9/21/2021,Fintech,Los Angeles,United States,North America,2016,"BOLDstart Ventures, Lerer Hippeau, Kenetic Capital",398,3000,2021,2602
BlockFi,3/11/2021,Fintech,Jersey City,United States,North America,2017,"ConsenSys Ventures, Valar Ventures, PUC",1000,3000,2021,2000
Blockstream,8/24/2021,Fintech,Vancouver,Canada,North America,2014,"AME Cloud Ventures, Future Perfect Ventures, Blockchain Capital",299,3000,2021,2701
BloomReach,2/23/2022,Artificial Intelligence,Mountain View,United States,North America,2009,"Bain Capital Ventures, Sixth Street Growth, Lightspeed Venture Partners",422,2000,2022,1578
Bluecore,8/5/2021,Artificial Intelligence,New York,United States,North America,2013,"FirstMark Capital, Georgian Partners, Norwest Venture Partners",238,1000,2021,762
BlueVoyant,2/23/2022,Cybersecurity,New York,United States,North America,2017,"8VC, Liberty Strategic Capital, Eden Global Partners",526,1000,2022,474
Boba,4/5/2022,Fintech,San Francisco,United States,North America,2018,"DeFi Technologies, Hypersphere Ventures, M13",45,2000,2022,1955
Bolt,5/29/2018,Auto & transportation,Tallinn,Estonia,Europe,2013,"Didi Chuxing, Diamler, TMT Investments",1000,11000,2018,10000
Bolt,10/8/2021,Fintech,San Francisco,United States,North America,2014,"Activant Capital, Tribe Capital, General Atlantic",1000,11000,2021,10000
bolttech,7/1/2021,Fintech,Singapore,Singapore,Asia,2018,"Mundi Ventures, Doqling Capital Partners, Activant Capital",210,1000,2021,790
Boom Supersonic,12/16/2020,Other,Englewood,United States,North America,2014,"WRVI Capital, Caffeinated Capital, Y Combinator",241,1000,2020,759
Bordrin Motors,6/3/2019,Auto & transportation,Shanghai,China,Asia,2016,"China Grand Prosperity Investment, CSC Group",362,1000,2019,638
Bought By Many,6/1/2021,Fintech,London,United Kingdom,Europe,2012,"Octopus Ventures, Munich Re Ventures, CommerzVentures",477,2000,2021,1523
Bowery Farming,5/25/2021,Other,New York,United States,North America,2015,"Temasek, Google Ventures, General Catalyst",237,2000,2021,1763
Branch,9/10/2018,Mobile & telecommunications,Redwood City,United States,North America,2014,"New Enterprise Associates, Pear, Cowboy Ventures",667,4000,2018,3333
BrewDog,4/10/2017,Consumer & retail,Aberdeen,United Kingdom,Europe,2007,"TSG Consumer Partners, Crowdcube",233,2000,2017,1767
Brex,10/5/2018,Fintech,San Francisco,United States,North America,2017,"DST Global, Ribbit Capital, Greenoaks Capital Management",1000,12000,2018,11000
Bringg,6/16/2021,"Supply chain, logistics, & delivery",Tel Aviv,Israel,Asia,2013,"Salesforce Ventures, next47, Pereg Ventures",185,1000,2021,815
BrowserStack,6/16/2021,Internet software & services,Dublin,Ireland,Europe,2011,"Accel, Insight Partners, Bond Capital",250,4000,2021,3750
Built,9/30/2021,Internet software & services,Nashville,United States,North America,2015,"Nyca Partners, Index Ventures, Technology Crossover Ventures",289,2000,2021,1711
Bunq,6/18/2021,Fintech,Amsterdam,Netherlands,Europe,2013,Undisclosed,281,2000,2021,1719
BYJU's,7/25/2017,Edtech,Bengaluru,India,Asia,2008,"Tencent Holdings, Lightspeed India Partners, Sequoia Capital India",4000,22000,2017,18000
Bytedance,4/7/2017,Artificial Intelligence,Beijing,China,Asia,2012,"Sequoia Capital China, SIG Asia Investments, Sina Weibo, Softbank Group",8000,180000,2017,172000
BYTON,4/20/2018,Auto & transportation,Nanjing,China,Asia,2016,"FAW Group, Tencent Holdings, Tus Holdings",1000,3000,2018,2000
C2FO,8/7/2019,Fintech,Leawood,United States,North America,2008,"Union Square Ventures, Summerhill Venture Partners, Mithril Capital Management",538,1000,2019,462
C6 Bank,12/2/2020,Fintech,Sao Paulo,Brazil,South America,2018,Credit Suisse,2000,5000,2020,3000
Cabify,1/22/2018,Auto & transportation,Madrid,Spain,Europe,2011,"Seaya Ventures, Otter Rock Capital, Rakuten",407,1000,2018,593
Cadence,12/14/2021,Health,New York,United States,North America,2020,"Thrive Capital, General Catalyst, Coatue Management",141,1000,2021,859
CAIS,1/11/2022,Fintech,New York,United States,North America,2009,"Franklin Templeton, Motive Partners, Apollo Global Management",406,1000,2022,594
Calendly,1/26/2021,Internet software & services,Atlanta,United States,North America,2013,"ICONIQ Capital, OpenView Venture Partners",351,3000,2021,2649
Calm,2/6/2019,Consumer & retail,San Francisco,United States,North America,2012,"Insight Venture Partners, TPG Growth, Sound Ventures",218,2000,2019,1782
Cambridge Mobile Telematics,12/19/2018,Mobile & telecommunications,Cambridge,United States,North America,2010,SoftBank Group,503,2000,2018,1497
Cameo,3/30/2021,Internet software & services,Chicago,United States,North America,2016,"Lightspeed Venture Partners, Kleiner Perkins Caufield & Byers, Origin Ventures",165,1000,2021,835
candy.com,10/21/2021,Fintech,New York,United States,North America,2021,"Insight Partners, Softbank Group, Connect Ventures",100,2000,2021,1900
Canva,1/8/2018,Internet software & services,Surry Hills,Australia,Oceania,2012,"Sequoia Capital China, Blackbird Ventures, Matrix Partners",572,40000,2018,39428
Cao Cao Mobility,1/17/2018,Auto & transportation,Hangzhou,China,Asia,2015,"People Electrical Appliance Group China, Zhongrong International Trust",744,2000,2018,1256
Capitolis,3/22/2022,Fintech,New York,United States,North America,2017,"Sequoia Capital, Index Ventures, S Capital",282,2000,2022,1718
Capsule,4/28/2021,Health,New York,United States,North America,2016,"Thrive Capital, Durable Capital Partners, G Squared",570,1000,2021,430
CaptivateIQ,1/26/2022,Fintech,San Francisco,United States,North America,2014,"Sequoia Capital, Y Combinator, Accel",165,1000,2022,835
Carbon,8/20/2015,Hardware,Redwood City,United States,North America,2013,"Google Ventures, Sequoia Capital, Wakefield Group",682,2000,2015,1318
Carbon Health,7/21/2021,Health,San Francisco,United States,North America,2015,"Brookfield Asset Management, Blackstone, Data Collective",523,3000,2021,2477
CarDekho,10/13/2021,E-commerce & direct-to-consumer,Jaipur,India,Asia,2008,"Sequoia Capital India, Hillhouse Capital Management, Sunley House Capital Management",448,1000,2021,552
CargoX,10/21/2021,"Supply chain, logistics, & delivery",Sao Paulo,Brazil,South America,2015,"Valor Capital Group, Lightrock, Softbank Group",390,1000,2021,610
Caris Life Sciences,5/12/2021,Health,Irving,United States,North America,1996,"Sixth Street Partners, OrbiMed Advisors, Highland Capital Management",1000,8000,2021,7000
Carousell,9/15/2021,E-commerce & direct-to-consumer,Singapore,Singapore,Asia,2012,"500 Global, Rakuten Ventures, Golden Gate Ventures",288,1000,2021,712
Carro,6/14/2021,E-commerce & direct-to-consumer,Singapore,Singapore,Asia,2015,"SingTel Innov8, Alpha JWC Ventures, Golden Gate Ventures",595,1000,2021,405
Cars24,11/24/2020,E-commerce & direct-to-consumer,Gurgaon,India,Asia,2015,"Moore Strategic Ventures, DST Global, Sequoia Capital India",1000,3000,2020,2000
Carsome,7/12/2021,E-commerce & direct-to-consumer,Selangor,Malaysia,Asia,2015,"Gobi Partners, 500 Startups, Ondine Capital",577,2000,2021,1423
Carson Group,7/14/2021,Fintech,Lincoln,United States,North America,2012,Bain Capital,524,1000,2021,476
Carta,5/6/2019,Fintech,San Francisco,United States,North America,2012,"Menlo Ventures, Spark Capital, Union Square Ventures",1000,7000,2019,6000
Carzone,3/1/2019,E-commerce & direct-to-consumer,Jiangsu,China,Asia,1995,"Alibaba Group,Co-Stone Venture Capital, Buhuo Venture Capital",946,2000,2019,1054
Cato Networks,11/17/2020,Cybersecurity,Tel Aviv,Israel,Asia,2015,"Aspect Ventures, SingTel Innov8, Greylock Partners",532,3000,2020,2468
Cava Group,4/27/2021,Other,Washington,United States,North America,2010,"SWaN & Legend Ventures, Revolution Growth, Invus Group",738,1000,2021,262
Cedar,3/9/2021,Fintech,New York,United States,North America,2016,"Thrive Capital, Founders Fund, Cocnord Health Partners",326,3000,2021,2674
Cell C,8/7/2017,Mobile & telecommunications,Midrand,South Africa,Africa,2000,"Blue Label Telecoms, Net1 UEPS Technologies",547,1000,2017,453
Celonis,6/26/2018,Data management & analytics,Munich,Germany,Europe,2011,"Accel, 83North",1000,11000,2018,10000
Celsius Network,10/12/2021,Fintech,Hoboken,United States,North America,2017,"WestCap Group, Caisse de depot et placement du Quebec",864,4000,2021,3136
Cerebral,6/10/2021,Health,San Francisco,United States,North America,2020,"Oak HC/FT Partners, Artis Ventures, WestCap Group",462,5000,2021,4538
Cerebras Systems,11/14/2018,Hardware,Los Altos,United States,North America,2016,"Benchmark, Foundation Capital, Sequoia Capital",720,4000,2018,3280
CFGI,9/15/2021,Fintech,Boston,United States,North America,2000,"The Carlyle Group, CVC Capital Partners",19,2000,2021,1981
Cgtz,2/21/2017,Fintech,Hangzhou,China,Asia,2014,"Shunwei Capital Partners, China Media Group, Guangzhou Huiyin Aofeng Equity Investment Fund",536,2000,2017,1464
